{
  "$schema": "http://json-schema.org/draft-07/schema#",
  "$id": "http://example.com/product.schema.json",
  "title": "CulturesIniParameterInformation",
  "description": "The definition of a parameter in the map.ini in Cultures.",
  "type": "object",
  "properties": {
    "name": {
      "description": "Name of the command",
      "type": "string"
    },
    "category": {
      "description": "The category enum the command belongs to.",
      "type": "string"
    },
    "displayName": {
      "description": "A more readable name to display (camel case)",
      "type": "string"
    },
    "documentation": {
      "description": "Documentation about the usage of the command (markdown).",
      "type": "string"
    },
    "parametersMin": {
      "type": "number",
      "description": "Minimum count of parameters."
    },
    "parametersMax": {
      "type": "number",
      "description": "Maximum count of parameters."
    },
    "parameters": {
      "type": "array",
      "items": [
        {
          "type": "object",
          "properties": {
            "name": {
              "type": "string"
            },
            "documentation": {
              "type": "string",
              "description": "(markdown)"
            },
            "type": {
              "type": "string",
              "enum": [
                "NUMBER",
                "TYPE"
              ]
            }
          },
          "anyOf": [
            {
              "properties": {
                "type": {
                  "const": "NUMBER"
                },
                "numberRange": {
                  "type": "object",
                  "properties": {
                    "min": {
                      "type": "integer"
                    },
                    "max": {
                      "type": "integer"
                    }
                  },
                  "additionalProperties": false
                },
                "numberHint": {
                  "type": "array",
                  "description": "Assigns names to the numbers this parameter takes. Used for automatic documentation to show the user-friendly name for numbers. Array is zero-based. Special value `<NONE>` is hidden from the user.",
                  "items": [
                    {
                      "type": "string"
                    }
                  ]
                },
                "numberHintsBitfield": {
                  "type": "array",
                  "description": "Like number hint, but assigns a user-friendly name to every bit of the number taken by this parameter. Array starts with the lowest-value bit.",
                  "items": [
                    {
                      "type": "string"
                    }
                  ]
                }
              },
              "required": [
                "type"
              ],
              "additionalProperties": false
            },
            {
              "properties": {
                "type": {
                  "const": "TYPE"
                }
              }
            }
          ],
          "required": [
            "name",
            "type"
          ],
          "additionalProperties": false
        }
      ]
    }
  },
  "additionalProperties": false,
  "required": [
    "name",
    "category",
    "parameters"
  ]
}
