{
  "name": "InfoCountAnimalsInArea",
  "category": "<dummy>",
  "documentation": "Shows the number of animals in the given area in the top right of the screen for the given player.\n\n*Note*: Only works with sheep and cattle.",
  "parameters": [
    {
      "name": "PlayerId",
      "type": "NUMBER"
    },
    {
      "name": "LineId",
      "type": "NUMBER"
    },
    {
      "name": "StringId",
      "documentation": "Place '%d' where the counted number should appear and another where the comparison number should appear.",
      "type": "NUMBER"
    },
    {
      "name": "TribeType",
      "documentation": "Only cattle and sheep work.",
      "type": "TYPE"
    },
    {
      "name": "PosX",
      "type": "NUMBER"
    },
    {
      "name": "PosY",
      "type": "NUMBER"
    },
    {
      "name": "Radius",
      "type": "NUMBER"
    },
    {
      "name": "Comparison",
      "documentation": "Allows to add a target (like '10/15 sheep') in the command rather than in the string.",
      "type": "NUMBER"
    }
  ]
}
