{
  "name": "Mission quit and play video",
  "category": "<dummy>",
  "documentation": "Quits the current mission/map and plays the given video.",
  "parameters": [
    {
      "name": "VideoId",
      "documentation": "Number will be resolved to '$gameroot$/dataX/FMV/(Ger/Eng,...)/seq_XXXX.mpg'",
      "type": "NUMBER"
    }
  ]
}
